[{
    "category": "milestones", 
    "documentationUrl": {
        "en": "https://github.com/open-contracting/ocds_milestone_documents_extension/blob/master/README.md"
    },
    "name": {
        "en": "Milestone documents"
    }, 
    "core": true,
    "url": "https://raw.githubusercontent.com/open-contracting/ocds_milestone_documents_extension/master/extension.json",
    "active": true, 
    "slug": "milestone_documents", 
    "description": {
        "en": "Documents at the milestone level were deprecated in OCDS 1.1. This extension re-introduces the ability to attach documents to each individual milestone."
    }
}]
