{
  "name": {
    "en" : "Budget breakdown"
  },
  "description": {
    "en": "For providing a detailed budget breakdown."
  },
  "url": "https://raw.githubusercontent.com/open-contracting/ocds_budget_breakdown_extension/master/extension.json",
  "documentationUrl": {
    "en":"https://github.com/open-contracting/ocds_budget_breakdown_extension/blob/master/README.md"
  },
  "active": true,
  "core": false,
  "category": "ppp, 1.1",
  "slug": "budget"
}
