{
  "name": {
    "en" : "Transactions - Related Milestones"
  },
  "description": {
    "en": "Adds a relatedImplementationMilestone property to the transactions object so that disbursements can be linked with their associated milestone."
  },
  "url": "https://raw.githubusercontent.com/open-contracting/ocds_transactions_relatedMilestone_extension/master/extension.json",
  "documentationUrl": {
    "en": "https://github.com/open-contracting/ocds_transactions_relatedMilestone_extension"
  },
  "active": true,
  "core": false,
  "category": "ppp",
  "slug": "transaction_milestones"
}
