[{
  "name": {
    "en" : "Requirements"
  },
  "description": {
    "en": "The requirements extension is based on the EU's Core Criterion and Core Evidence Vocabulary (CCCEV) model for communicating criteria and responses. The extension is designed to allow procuring entities or buyers to express criteria, relating to either items being procured or bidders themselves, as structured data."
  },
  "url": "https://raw.githubusercontent.com/open-contracting/ocds_requirements_extension/master/extension.json",
  "documentationUrl": {
    "en": "https://github.com/open-contracting/ocds_requirements_extension/blob/master/README.md"
  },
  "active": true,
  "core": false,
  "category": "tender",
  "slug": "requirements"
}]
