{
    "category": "tender", 
    "documentationUrl": {
        "en": "https://github.com/open-contracting/ocds_lots_extension/blob/master/README.md"
    },
    "name": {
        "en": "Lots"
    }, 
    "core": true, 
    "url": "https://raw.githubusercontent.com/open-contracting/ocds_lots_extension/master/extension.json",
    "active": true, 
    "slug": "lots", 
    "description": {
        "en": "A tender process may be divided into lots, where bidders can bid on one or more lots. Details of each lot can be provided here. Items, documents and other features can then reference the lot they are related to using relatedLot. Where no relatedLot identifier is given, the values should be interpreted as applicable to the whole tender."
    }
}
