[{
    "category": "tender", 
    "documentationUrl": {
        "en": "https://github.com/open-contracting/ocds_enquiry_extension/blob/master/README.md"
    },
    "name": {
        "en": "Enquiries"
    }, 
    "core": true, 
    "url": "https://raw.githubusercontent.com/open-contracting/ocds_enquiry_extension/master/extension.json", 
    "active": true, 
    "slug": "enquiries", 
    "description": {
        "en": "The enquiries extension can be used to record questions raised during a contracting process, and the answers provided."
    }
}]
