[{
    "category": "tender", 
    "documentationUrl": {
        "en": "https://github.com/open-contracting/ocds_participationFee_extension/blob/master/README.md"
    },
    "name": {
        "en": "Participation Fees"
    }, 
    "core": true, 
    "url": "https://raw.githubusercontent.com/open-contracting/ocds_participationFee_extension/master/extension.json",
    "active": true, 
    "slug": "participation_fee", 
    "description": {
        "en": "Where a tender process involves payment of fees to access documents, submit a proposal, or be awarded a contract, this extension can be used to provide fee details."
    }
}]
