{
  "name": {
    "en" : "Multiple buyers - contract level"
  },
  "description": {
    "en": "In some cases, a single contracting process involves multiple buyers (for example, a framework that different organisations can buy from). In these cases, the multiple buyers extension can be used to specify a distinct buyer for each contract."
  },
  "url": "https://raw.githubusercontent.com/open-contracting/ocds_multiple_buyers_extension/master/extension.json",
  "documentationUrl": {
    "en": "https://github.com/open-contracting/ocds_multiple_buyers_extension"
  },
  "active": true,
  "core": false,
  "category": "1.1",
  "slug": "contract"
}
