{
    "category": "bids", 
    "documentationUrl": {
        "en": "https://github.com/open-contracting/ocds_bid_extension/blob/master/README.md"
    },
    "name": {
        "en": "Bid statistics and details"
    }, 
    "core": true, 
    "url": "https://raw.githubusercontent.com/open-contracting/ocds_bid_extension/master/extension.json", 
    "active": true, 
    "slug": "bids", 
    "description": {
        "en": "Allowing bid statistics, and detailed bid information to be represented."
    }
}
